String	Translation
I cannot but object to his proposal .	私は彼の提案に反対せざるを得ない
This car is always breaking down lately .	この車は近ごろ故障ばかりしている
You have infinite possibilities as an artist .	あなたは芸術家としての無限の可能性を秘めている
He crossed me up .	彼は私を裏切った
You must take into account the fact that she was ill .	あなたは彼女が病気だったということを考慮に入れなければならない
I missed the last bus , and was obliged to walk home in the rain .	私は終バスに乗り遅れてうちまで雨の中を歩かなければならなかった
Don't rush into the situation until you have all the details; hold your horses until you know where you are going .	詳しいことが全部わかるまではあわててその場にふみこむな見当がつくまでは慎重にかまえておれ
People have eaten with their fingers from the beginning of history .	人類は太古の昔から指を用いて食べ物を食してきたのである
I think you had better stick to your present job .	あなたは現在の仕事を続けた方がいいと思います
Will you help me for a minute ?	ちょっと私をたすけてくれませんか
Oh , the driver is a maniac .	なあこの運転士いかれてるよ
He managed to pass the examination .	彼は試験になんとか合格した
Don't work too hard .	働き過ぎないように
Tea is like the lubricating oil of work to allow it to proceed smoothly .	お茶は仕事をスムーズに運ばせるための潤滑油のようなもの
Suddenly , a terrible storm came up .	突然恐ろしい嵐がやってきた
If anyone should phone , say I will be back at one o'clock .	誰かから電話があったら一時に戻るといって下さい
In the first place , we must be careful about what we eat and drink .	第一に飲食に注意しなければならない
I missed the 7:00 train .	時発の電車に乗り遅れた
This soup wants a bit of salt .	このスープは塩が少し足りない
That car is a real beauty .	あの車は全くすばらしいものだ
Tom feels that his team will win the game .	は自分のチームが試合に勝つだろうと思っている
How are the kids ?	子供たちは元気
He is no good as a doctor .	彼は医者として無能だ
I will do anything but this .	これ以外のことなら何でもする
Let's hash it all out .	とことん話し合ってわかりあおうよ
He went into teaching .	彼は教職に就いた
Take a look at this map .	ちょっとこの地図を見なさい
People used to think that only humans could use language .	人々は人間しか言語を使えないと以前は考えていた
Though she is rich , she is not happy .	金持ちにかかわらず彼女は幸せでない
They are pleased with your work .	彼等は仕事に満足している
The frequency of crime in the town is high .	この町における犯罪の発生率は高い
The admission is ten dollars a person .	一人ドルです
The astronaut was slow to get used to the condition of weightlessness .	その宇宙飛行士は無重力の状態になかなか慣れなかった
I said , Could you please turn your television down ?	テレビの音を小さくしてもらえませんかって言ったんですよ
She played an important part in the drama .	彼女はそのドラマで重要な役を演じた
What to do next is the question .	次に何をすべきかが問題である
You should restore the money he lost to him .	君は彼に彼がなくしたお金を戻すべきだ
Will you notify me after 3 minutes ?	分たったら教えてもらえますか
The hotel charged me 8000 yen for the room .	ホテルは部屋代として私に円請求した
She continued writing in her diary until she died .	彼女は死ぬまで日記を書きつづけた
Did you enjoy watching the night game last night ?	昨夜はナイターを見て楽しみましたか
Mischief is common to most children .	いたずらはたいていの子供に共通のものだ
Each country has its own customs .	所変われば品変わる
Advance two steps .	歩前に出なさい
Here are your boarding pass and your baggage claim .	搭乗券と荷物の引き換え証です
He was in such a good mood when his team won the championship .	彼は自分のチームが選手権に勝って上機嫌だった
Mr Smith is in charge of the class .	先生はそのクラスの担任だ
It is certain that prices will go up .	物価が上がるのは確かだ
You'd better consult an attorney beforehand .	事前に弁護士と相談した方がいいよ
All but the boy were asleep .	その少年以外はみんな眠っていた
Making use of fire may be regarded as man's greatest invention .	火の利用が人類の最大の発明と考えてもよいでしょう
Hurry , or you'll miss the train .	急がないと列車に乗り遅れますよ
Whatever he may say , I won't change my mind .	彼が何と言おうと私は心変わりしません
It is very kind of you to say so .	そう言ってくれて君はとても親切だ
There were quite a few students absent from class today .	今日授業を欠席した学生は多かった
He turned out to be a real disappointment after we went through hell and high water to find him .	鉦や太鼓で探しあてた割にはあいつ期待はずれだったよな
Beyond the novel we come to works whose avowed aim is information .	小説の次には知識を与えることを目的とする作品がある
We cannot meet the demands of the hijackers .	乗っ取り犯人の要求には応じられない
I can't check my mail . The server is down .	サーバーがダウンしててメールチェックできない
What a mean fellow!	なんと卑劣な奴だ
School begins at half past eight .	授業は時半に始まる
You're always criticizing me!	君はいつも僕を批判している
Stand back , please .	どうぞ後ろに下がってください
Moreover , they underscored the need for providing policy relevant ready-to-use scientific results and methodology .	さらに即戦力となる政策関連の科学的成果や手段の提供が必要であると強調した
He returned to America .	彼はアメリカに戻った
She will cope with all the work .	彼女なら仕事をすべて上手くやるだろう
She found pleasure in reading .	彼女は読書に楽しみを見いだした
She did not answer all the questions .	彼女は必ずしもすべての質問に答えたわけではない
Little birds are singing merrily .	小さな鳥が楽しげにさえずっている
He breathed his last peacefully this morning .	彼は今朝安らかに息を引き取った
Did you see a doctor ?	医者に診てもらったのか
He tried writing a short story .	彼は試しに短い物語を書いてみた
He said a few words by way of apology .	彼は言い訳として二三述べた
I must remind you of your promise .	約束したことを思い出して下さい
Never before have we had such a strong longing for peace .	これほどまでに平和を切望した事はかつて無い
Don't stand by me .	僕のそばに立たないでくれよ
I can only tell you what I know .	私は知っていることしかお話できません
She was in a silk dress .	彼女はシルクのドレスを着ていた
I heard a cry for help .	助けを呼ぶ声が聞こえた
Masao studies history under Prof . Ito's guidance .	は教授の指導のもと歴史を研究している
It is admitted that the hotel is the best in this area .	そのホテルはこの辺りでは最高だとの折り紙つきです
Language is peculiar to man .	言語は人間に特有のものである
This toy car runs on batteries .	このおもちゃの自動車は電池で動く
Where do you go to school ?	学校はプールの水を月一回排水oK
She may have to quit her job next month .	彼女は来月退職しなければならないかもしれません
His speech was not altogether bad .	彼の演説はまんざら捨てたものではなかった
The weather turned fair .	天気が好転した
She was required to step down in the office .	彼女はその会社を辞任するよう求められた
He is named Jim after his uncle .	彼は叔父の名前をとってと名づけられた
It's natural that Yoko should say a thing like that .	がそういうのももっともだ
He sometimes wished to go to extremes .	彼はときどき極端な手段に訴えたくなった
She wanted to have paid a visit to India .	彼女はインドに行きたかったのだが
He is fresh from college , so he has no experience .	彼は大学を出たばかりでまったく経験がない
You should pay your rent in advance .	君は部屋代を前もって払うべきだ
I came to Liverpool by chance .	私は偶然にに来たのだった
The nun prayed and crossed herself .	尼僧はお祈りをして十字を切った
There was a new candidate on the ticket at the Democratic convention .	新しい候補者が民主党の党大会で公認候補となりました
I'm a free man .	俺は自由な男
She took in the washing when it started to rain .	雨が降り出すと彼女は洗濯物を取り込んだ
You can't understand this sentence , can you ?	この文の意味がわからないのですね
He seems to have been rich before .	彼は以前金持ちだったらしい
You don't have to talk so loud .	あなたはそんな大声で話す必要はない
The hunters aimed at the elephant .	猟師たちは銃でその象をねらった
He was standing at the top of the mountain .	彼は山の頂上に立っていました
The author made ten mistakes in as many pages .	その著者はページに個の誤りをおかした
No sooner had it stopped raining than a beautiful rainbow appeared .	雨が止んだとたんにきれいな虹が出た
The roof was damaged by the storm .	屋根は嵐の被害を受けました
The scandal robbed him of a chance to become President .	そのスキャンダルのために彼は大統領になる機会を失った
Jane wore the same ribbon as her mother did .	は彼女の母親と同じリボンをつけていた
The police arrested him for theft .	警察は盗みで彼を逮捕した
You need to reverse your vest , it's back to front .	ベストを裏返さなくちゃ表裏逆ですよ
He has great ability as an artist .	彼は芸術家としてたいへん才能がある
I noticed you entering my room .	君が部屋に入ってくるのに気づいた
Another war , and we all will be killed .	もう一度戦争があれば我々は皆死ぬだろう
He was happy at the news of her success .	彼女の成功を聞いて彼は喜んだ
Drive more slowly , or you'll get a ticket .	もっとゆっくり運転しないと違反切符をもらうことになるよ
Follow me and do exactly the way I do it .	私に続いて私がやるのと全く同じようにやってください
I've got to earn my own living .	私は自分の生活費を稼がなくてはならない
Asked what exactly a right was , I was at a loss to explain it .	権利は正確には何であるのかと聞かれて私は説明に困った
What do you say to playing tennis with me ?	私とテニスをしませんか
Mary and I are in the same class .	と私は同じクラスだ
Could you tell me which way I should go ?	どちらにいったらいいのか教えてくださいませんか
We take our high standard of living for granted .	私たちは豊かな生活水準を当然のことと思っています
Technology will make a lot of progress in the nineties .	年代に科学技術はおおいに進歩するだろう
He was equal to the job .	彼はその仕事をやれる力量があった
She sometimes has her sister write her term papers .	彼女はときどき妹にレポートを書かせる
I got him to polish my shoes .	私は彼に靴を磨いてもらった
What do you think we must do in order to maintain the peace of the world ?	世界の平和を維持するにはわれわれはどうしなければならないと思いますか
Will you join me for a drink ?	一緒に飲みませんか
We cannot help missing you badly .	私たちは君がいなくてとても寂しくてたまらない
He is a reporter for Time magazine .	彼はタイム誌の記者です
She fled for fear of being caught .	彼女はつかまるといけないので逃げた
He is two years older than Ogawa .	彼は小川より二歳年上です
The house stands by itself .	その家は一軒だけぽつんと立っています
His lack of cooperation defeated our plan .	彼の協力がなかったので我々の計画はだめになった
Her blue shoes go well with that dress .	彼女の青い靴は衣服によく似合っている
Her wish is to study abroad someday .	彼女の願いはいつか外国に留学することだ
She is very fond of standing out .	彼女は目立ちたがり屋だ
I am delighted to meet you .	あなたにお会いできて嬉しい
Acting on your advice , I've decided to exercise more regularly .	あなたの忠告に従い私は運動をもっと規則正しくすることに決めました
It overflows into a paper cup .	ペーパー・カップの中へとあふれでていく
The young men of Japan are apt to jump on the bandwagon .	日本の若者は流行に乗る傾向があります
Hi , George! How's it going ?	こんにちはどう
Please pardon me for coming late .	遅れて申し訳ありません
Is this a radio ?	これはラジオですか
I'm too tired to walk any further .	疲れていてこれ以上歩けません
The boy persisted in wearing his hair long .	その男の子はあくまでも髪の毛を伸ばすことにこだわった
Everyone attacked my opinion .	みんなが僕の意見を攻撃した
Who is responsible for this class ?	このクラスの担任は誰ですか
He went to America last year to brush up his English .	彼は英語に磨きをかけるため昨年アメリカへ行った
I explained to her what the matter was .	何が起こったのか彼女に説明した
I had intended to finish this yesterday , but I couldn't .	私はこれを昨日仕上げるつもりだったのですができなかったのです
On encountering the celebrity , the fans asked for his autograph .	ファン達は有名人と出くわすなり彼にサインを求めた
I'm opposed to any type of war .	私はどんな戦争にも反対だ
The Balkan Mountain range runs across Bulgaria from west to east .	山脈はブルガリアの中央を東西に走る山脈
He carved marble into a statue .	彼は大理石を刻んで像を作った
This vending machine isn't working .	この自動販売機動かないんですが
What do you do before breakfast ?	あなたは朝食の前になにをしますか
She refused his offer .	彼女は彼の申し出を拒否した
She is very attentive to her grandmother .	彼女はおばあちゃんをたいそう大事にする
He is man who I think has never known poverty .	彼は貧乏の経験がないと私が思っている男だ
The pencil which writes well is mine .	よく書ける鉛筆は私のものです
Nothing is more delightful for me than to talk with him .	私にとって彼と語り合うほど楽しいことはない
I'd like to go to Hawaii .	ハワイに行きたいものです
He seized the pickpocket by the collar .	彼はすりの襟首を掴んだ
These three pretty girls are all nieces of mine .	この３人の美しい少女はみな私の姪です
It wasn't very discreet of you to forget the appointment .	約束を忘れるとはあまり慎重ではなかったですね
Happiness lies in contentment .	幸福とは満足することに有る
The doctor alerted him to the riskiness of the medicine .	医者は彼にその薬の危険性を警告した
He never fails to do what he says .	彼は口に出すことは必ずする
I am glad to have helped you last week .	先週あなたのお手伝いができてうれしく思います
He is a famous painter and should be treated as such .	彼は高名な画家だからそういうものとして扱うべきだ
You don't have to pay in cash .	現金で払う必要はありません
I call on him every other day .	私は一日おきに彼を訪問します
I was very tired , but I was nevertheless unable to sleep .	私は疲れていたがそれにもかかわらず眠れなかった
Some are happy; others unhappy .	幸福な者もいればまた不幸な者もいる
After all , it is talent that counts in music .	結局のところ音楽で物を言うのは才能だ
People tend to look at others with bias .	人々は他人を偏見で見がちだ
Dave never returned to school again .	は二度と学校に戻らなかった
I believe whatever he says .	私は彼の言う事なら何でも信じる
After all his efforts , he also failed this time .	いろいろ努力したにもかかわらず彼は今回も失敗した
The prince of darkness means Satan .	暗黒の王子とは悪魔のことです
This institution came into being after the war .	この組織は戦後生まれた
Gold is more precious than iron .	金は鉄よりも貴重だ
I've got to get out of here .	そろそろ失礼しなくては
No boy in the class is taller than Bill .	クラスでより背の高い少年はいない
I have known her since she was a baby .	私は彼女が赤ん坊のころから知っています
Many a little makes a mickle .	ちりも積もれば山となる
Put it where you like .	好きなとこへ置けよ
This is the year 1990 .	今年は年です
The suitcase contained nothing but dirty clothes .	スーツケースには汚れた服しか入ってなかった
She came home very late .	彼女はとても遅く帰宅した
The court judged him guilty .	法廷は彼に有罪の判決を下した
I don't make much of his opinion .	私は彼の意見をあまり重視しない
Lucy turned on the light switch .	は電灯のスイッチをつけた
Did you put a stamp on the envelope ?	その封筒に切手を貼りましたか
Did he fail again ?	彼はまた失敗したのですか
Start a new paragraph here .	ここで改行しなさい
It is surprising that he should not know this .	彼がそのことを知らないとは驚きだ
She is the messenger .	彼女は使いの者です
The train he was on could no longer be seen .	彼の乗った列車は見えなくなってしまった
I wish I could live at a more relaxed pace , instead of having to watch the clock all the time .	のんびりとした生活で時間に縛られない生き方ができればな
He was always as good as his word .	彼はいつも約束を守っていた
She sang with a beautiful voice .	彼女は美しい声で歌った
There is no longer any room for doubt .	もはや疑いの余地はない
They don't have an ear for music .	彼等には音楽を聴く耳がない
I remarked on the beauty of the landscape .	私は風景の美しさについて述べた
He jumped across the puddle .	彼は水たまりを飛び越した
The meaning of words can change according to their context .	言葉の意味は文脈によって変わりうる
She gave me access to her records .	彼女はレコードを聞いていいと言ってくれた
The dinosaurs in the film Jurassic Park were true to life .	映画の恐竜は本物そっくりだ
Her large income enables her to go to Paris every year .	彼女は収入がたくさんあるので毎年パリに行くことが出来る
He sent fruit and vegetables to his daughter .	彼は娘に果物と野菜を送った
Plain English is a shortcut to the goal of language learning .	プレインイングリッシュは語学習得の近道です
She was excused attendance at the meeting .	彼女の会への出席を免除してもらった
She must come home by 9 at latest .	彼女は遅くとも九時には帰宅せねばならない
The enemy flung fresh troops into the battle .	敵は新兵力を投入した
She earns her living by playing the violin .	彼女はバイオリンを弾いて生活費を稼いでいる
Shaving off your beard took ten years off you .	髭剃ったら歳は若返って見えるよ
From the look on his face , he is in a bad mood now .	彼の顔つきからすると今は機嫌が悪い
It is hard for an empty sack to stand straight .	衣食足りて礼節を知る
That was the most exciting concert I have ever been to .	それは今までに行った中で一番楽しいコンサートだった
However , we can be people of the earth .	しかし地球人になることは可能なのです
How on earth did you get into our room ?	いったいどうやって私たちの部屋に入ってきたのか
God above helped us .	天におわす神のお力添えがあった
He handed down books from the shelf .	彼は本棚から本をとりおろした
Ueno is the station after next .	上野駅は次の次です
General admission is $7 for adults .	一般入場料は大人がドルです
This car wax gives permanent protection against heavy rain .	このカーワックスは大雨にも長持ちする保護となります
The man reading a book over there is my father .	向こうで本を読でいる人はわたしの父です
Black smoke came out of the chimney .	煙突から黒い煙が出てきた
He likes to build model planes .	彼は模型飛行機を作るのが好きだ
Please be sure to give my best regards to your father .	必ずあなたのお父さんによろしくお伝え下さい
We can know in advance what excuse he will make .	彼がどんな言い訳をするかはあらかじめ分かってしまう
