The weather is becoming cooler.	涼しい{涼しく} 成る{なって} 来る{きた}
He finished the work at the expense of his health.	彼 は 健康 を 犠牲 に 為る{して} 其の{その} 仕事 を 終える{終えた}
Don't take the trouble to come and meet me.	態々{わざわざ} 迎えに来る 様{ような} 事{こと} は 為る{しないで} 下さい
He suffered an insult.	彼 は 甘んじる{甘んじて} 屈辱 に 耐える{耐えた}
Everyone is friendly to her.	皆{みんな} 彼女 に 親切 です
"Be that as it may, you are wrong."	其れ{それ} は 兎に角{とにかく} 君 が 悪い
"There's nothing to do, so I may as well go to bed."	何も 為る{する} 事{こと} が 無い{ない} なら 寝る{寝た} 方がいい
She invited me to dinner.	彼女 は 私 を 食事 に 招く{招いて} 呉れる{くれた}
There is no more important problem than this.	此れ程{これほど} 重要{重要な} 問題 は 無い{ない}
She held on to my hand tightly.	彼女 は 私{私の} 手 に 確り{しっかりと} しがみ付く{しがみ付いた}
How did you reply?	何て 答える{答えた} の
The net-cafes here cater to students; fees start at around a pound an hour.	此処{ここ} の ネットカフェ は 学生 相手 の 店 で 料金 は 一時間{１時間} 約 円 から となる{となります}
Rosie was allowed to stay up till eleven o'clock.	は 時 迄{まで} 起きる{起きている} 事 を 許す{許された}
The colony declared independence.	其の{その} 植民地 は 独立 を 宣言 為る{した}
My health makes me a very slow worker.	健康 の所為で{のせいで} 仕事 が 一向に{いっこうに} 捗る{はかどらない}
Don't haggle over a small sum of money.	僅か{わずかな} 額 の 事{こと} で 言い争う の は 止す{よせ}
The person whose name was on the passport was described with words.	パスポート に 名前 が 記載 為れる{されている} 人 は 言葉 で 述べる{述べられていた}
I can't buy a book this expensive.	そんな 高価{高価な} 本 は 買う{買えない}
With this his spirit will be consoled.	此れ{これ} で 彼 の 霊 も 浮かぶ{浮かばれる} だろう
We could barely make out two figures in the dark.	闇{闇の} 中 で 辛うじて{かろうじて} 二人{２人} の 人影 が 見分ける{見分けられた}
I'm already accustomed to the heat of summer.	夏 の 暑い{暑} さ にも もう 慣れる{慣れました}
He's eating an apple.	彼 は 林檎{りんご} を 食べる{食べています}
"It being awfully cold, the party were almost frozen to death."	迚も{とても} 寒い{寒かった} ので 一行 は 凍死 為る{する} 所{ところ} だ{だった}
I worked far into the night.	私 は 夜遅く 迄{まで} 働く{働いた}
I am good friends with Bill.	私 は と 仲良し です
A TV set of this size will take little space.	此の{この} 型 の テレビ なら 余り{あまり} 場所を取る{場所をとらない} でしょう
The city is well supplied with water.	其の{その} 市 には 十分{十分に} 水 が 供給 為れる{されている}
The ruling party is running a smear campaign against the opposition.	与党 は 野党 非難 の キャンペーン を 展開 為る{しています}
I had a miscarriage last year.	去年 流産 為る{しました}
I am afraid that I shall not be free till the examination is over.	試験 が 済む 迄{まで} は 忙しい{忙しくて} 暇がない だろう と 思う{思います}
I have labor pains every thirty minutes.	陣痛 が 分 置きに{おきに} 起こる{起こります}
He's too busy.	彼 は 忙しい{忙し} 過ぎる{すぎる} の{ん} だ よ
Do you wonder why no one trusts him?	誰も 彼 を 信用 為る{しない} の を 変 だ と 思う{おもう} かい
Let me congratulate you on your victory in the tournament.	トーナメント で の 優勝 お目出度う{おめでとう} 御座います{ございます}
I refused absolutely.	私 は 断固 として 拒絶 為る{した}
We had a little water.	私たち には 水 が 少し 有る{ありました}
He was beaten black and blue.	彼 は 殴る{殴られて} 青痣{青あざ} が 出来る{できた}
You must on no condition open the box.	どんな事があっても{どんなことがあっても} 其の{その} 箱 を 開ける{開けて} は 行けない{いけない}
Would you be kind enough to explain it to me?	恐れ入りますが 其の{その} 事{こと} を 私 に 説明 為る{して} 頂ける{いただけません} でしょうか
California is about as large as Japan.	カリフォルニア は 日本 と 同じくらい の 広い{広} さ だ
Two weeks went by.	週間 が 過ぎる{過ぎた}
I think it's somewhere around here.	この辺り{このあたり} に 有る{ある} と 思う のだ{のです} が
That person has had an odd grin on his face for a while. What do you suppose is behind it?	さっき から あの人 一人で ニヤニヤ{にやにや} 為る{して} 怪しい
They cleared the streets of snow.	彼ら は 通り を 除雪 為る{した}
He bought her a dog.	彼 は 彼女 に 犬 を 買う{買って} 遣る{やった}
An old woman was burnt to death.	老婆 が 焼け死ぬ{焼け死んだ}
Were they let in on the secret?	彼ら は 秘密 を 知らす{知らされた} の だろうか
"Excuse me, but may I ask you something."	一寸{ちょっと} 尋ねる{おたずね} 為る{します} が
Can you write a letter in English?	貴方{あなた} は 英語 で 手紙 を 書く 事が出来る{ことが出来ます} か
I slept well last night.	私 は 昨夜 良い{良く} 眠る{眠れた}
"How is it? ""Well, yes ... could be some signs of dehydration."""	具合 は 如何{どう} なのだ{なんです} か 嗚呼{ああ} うん 少し 脱水症状 が 出る{出ている} かな
I got acquainted with her in France.	私 は 仏蘭西{フランス} で 彼女 と 知り合う{知り合った}
They must've skipped out of town.	彼ら は 高飛び{高飛びした} に 違いない
He knows how to behave in public.	彼 は 人前 で 如何{どう} 振る舞う{振舞う} か を 知る{知っている}
Bobby may watch TV until 7:00.	は 時 迄{まで} テレビ を 見る{みて} 良い{いい} わ
He should be back any minute.	彼 は 直ぐ{すぐ} 戻る 筈{はず} です
I've worn out two pairs of shoes this year.	私 は 今年 二足{二足の} 靴 を 履く{はき} 潰す{つぶした}
I informed him of the result.	私 は 彼 に 結果 を 知らせる{知らせた}
Who made this pie?	誰 が 此の{この} パイ を 作る{作った} の
Sports nurture friendships.	スポーツ は 友情 を 育くむ{はぐくむ} 物{もの} だ
How long have you lived in Kobe?	貴方{あなた} は どの位{どのくらい} の 間 神戸 に 住む{住んでいます} か
"Even toddlers can do it, so I'd like you to enjoy yourselves as a family."	よちよち歩き{よちよち歩きの} 幼児 でも 出来る{できる} の だ から 家族 で 楽しむ{楽しんで} 頂く{いただき} たい
I met her by accident.	私 は 偶然 彼女 に 会う{会った}
She stayed there for a short while.	彼女 は 少し の 間 其処{そこ} に 滞在 為る{した}
She is afraid of barking dogs.	彼女 は 吠える 犬 を 怖がる
These meetings are carried on entirely in English.	此れ等{これらの} 会合 は 全部 英語 で 行われる
He's looking for someone to serve him.	彼 は 自分 に 尽くす{尽くして} 呉れる{くれる} 人 を 探す{探しています}
"He came out shooting, same as you said he would."	君{君の} 予言 通り{どおり} 奴{やつ} は 撃つ{うって} 来る{きた}
She hung a little Picasso on the wall of the drawing room.	彼女 は 居間 の 壁 に 小さな ピカソ の 絵 を 掛ける{掛けた}
Jobs are hard come by these days.	此の{この} 頃 は 仕事 に 有り付く{ありつく} の が 難しい
We do not always take his advice.	私たち{私達} は 何時も{いつも} 彼{彼の} 忠告 を 取り入れる と 言う{いう} 訳ではない{わけではない}
He deeply deplored the situation.	彼 は 現状 を 大いに 嘆く{嘆いた}
I know some of these boys.	私 は 此れ等{これらの} 少年 の 内{うち} 何人か を 知る{知っている}
Kate may well complain of her husband.	が 夫 の 不平 を 言う の も 尤も{もっとも} だ
It shines on the beautiful sea.	其の{その} 光 が 美しい 海 に 輝く
"His mother died when he was young, and his grandmother brought him up."	彼{彼の} 母親 は 彼 が 小さい 時{とき} に 亡くなる{亡くなった} ので お祖母さん が 彼 を 育てる{育てた}
"Not liking carrots, he didn't eat it."	彼 は 人参{ニンジン} が 好き では無い{ではない} ので 食べる{食べなかった}
Not a day passes without traffic accidents.	交通事故 の 無い{ない} 日 は 一日{１日} として 無い{ない}
The kid got hurt.	其の{その} 子 は 怪我 を 為る{した}
He arrived in time.	彼 は 時間通り 到着 為る{した}
I have never heard from him since.	それ以来 彼 から は 何の 便り も 有る{ありません}
He was denounced as a coward.	彼 は 卑怯者 だ と 非難 為れる{された}
"If I am dull, I am at least industrious."	仮令{たとえ} 私 は 頭 が 鈍い{鈍く} とも 少なくとも 勤勉 だ
The greatest pleasure I know is to do a good action by stealth and have it found out by accident.	私{私の} 知る{知っている} 最大 の 喜び は 密か{ひそかに} 良い{よい} 行い を 為る{して} 偶然 人 に 知る{知られる} 事{こと} である
You'd better eat everything that's on your plate.	お皿 に 取る{取った} 物{もの} は 全部 食べる{食べ} なさい
My uncle was willing to agree to my suggestion.	私{私の} 叔父 は 快い{快く} 私{私の} 提案 に 同意 為る{して} 呉れる{くれた}
That's where you're mistaken.	其処{そこ} が 貴方{あなた} の 間違う{間違っている} 所{ところ} です
The chairman did not rule out the possibility of a disagreement.	議長 は 意見 が 不一致 に 終わる{終る} 可能性 を 排除 為る{しなかった}
It is no use making an excuse for this.	此れ{これ} に就いて{について} 言い訳 為る{して} も 無駄{むだ} だ
He assimilated what he was taught.	彼 は 教わる{教わった} 事{こと} を 自分 の 物{もの} とする{とした}
I have a friend everybody trusts.	私 には 皆{みんな} に 信用 為れる{されている} 友達 が 居る{いる}
Human beings have achieved a lot more than animals.	人間 は 動物 より 遥か{はるかに} 多く の 偉業 を 成す{なして} 来る{きた} の である
"It is not because I hate him, but because I love him."	其れ{それ} は 私 が 彼 を 憎む{憎んでいる} から だ{ではなくて} 彼 を 愛する{愛している} から です
"If it were not for the sun, nothing could live."	太陽 が 無ければ{なければ} 何も 生きる{生きられない} だろう
It is ten years since I saw her last.	彼女 に 最後 に 会う{会って} から 年 になる{になります}
Both of my sisters are not married.	私{私の} 姉 が 二人とも 結婚{結婚している} 訳ではない{わけではない}
Would you please lock the door?	ドア に 鍵をかける{鍵をかけて} 下さる{くださいません} か
"If you have an umbrella, let me join you under it."	傘 を 持つ{お持ち} なら 入れる{入れさせて} 下さい{ください}
Let's continue with the lesson for today.	今日 の 勉強 を 続ける{続けましょう}
"When I flew to New York, I was told to check in two hours before my flight."	私 は ニューヨーク へ 飛ぶ{飛んだ} 時{とき} 時間 前 に 搭乗 手続き を 取る{とる} 様{ように} と 言う{言われた}
She told a white lie out of necessity.	彼女 は 必要 に 迫る{迫られて} 罪 も 無い{ない} 嘘をつく{うそをついた}
He is not young any more than I am.	彼 は 私 と 同様 若い{若くない}
She rose to her feet with tears in her eyes.	彼女 は 目 に 涙 を 浮かべる{浮かべて} 立ち上がる{立ちあがった}
He had a hungry look.	彼 は ひもじい{ひもじそうな} 顔 を 為る{していた}
I found him riding a bicycle in the park.	私 は 彼 が 公園 で 自転車 に 乗る{乗っている} の を 見つける{見つけた}
A house is built on top of a solid foundation of cement.	家 は 堅固{堅固な} セメント の 基盤 の 上 に 建てる{建てられる}
Ninety-nine always makes me laugh.	は 何時も{いつも} 私 を 笑う{笑わせる}
Jim acted very strangely all day.	は 一日中{１日中} 行動 が 可笑しい{おかしかった}
The man dashed the bottle against the wall.	其の{その} 男 は 瓶{ビン} を 壁 に 叩き付ける{叩きつけた}
I met an old student of mine in London.	ロンドン で 昔{昔の} 教え子 に 会う{会った} よ
The trade imbalance bulks large in our minds.	貿易 不均衡 が 大きな 問題 である 様に{ように} 思える
She looked better than last time.	彼女 は 前 より 元気 そう だ{だった}
This is a picture painted by him.	此れ{これ} は 彼 に因って{によって} 描く{かかれた} 絵{画} です
That altered the aspect of the case.	其れで{それで} 形勢 が 変わる{変わった}
Yumi went there by herself.	は 一人で 其処{そこ} へ 行く{行った}
More than half the residents are opposed to the plan.	住民 の 半数 以上 は 其の{その} 計画 に 反対 だ
That added to his unhappiness.	其れで{それで} 余計{余計に} 彼 は 不幸 になる{になった}
At last he found the evidence he was looking for.	彼 は 到頭{とうとう} 其の{その} 証拠 を 発見 為る{した}
He had a share in completing the job.	彼 は 其の{その} 仕事 を 完成 為る{する} のに 貢献 為る{した}
The garden is common to the two houses.	庭 は 二 軒 の 家 の 共有 の 物{もの} です
But you just come here in the summer! Said Tony.	でも 君たち{君達} が 此処{ここ} に 来る の は 夏 丈{だけ} では無い{ではない} か と が 言う{言いました}
He not only does not work but will not find a job.	彼 は 働く{働かない} だけでなく 仕事 を 探す{探そう} とも 為る{しない}
"Her sister I like very much, but her brother I do not like."	彼女{彼女の} 妹 は 大好き だ が 彼女{彼女の} 弟 は 好き では無い{ではない}
Will you go to America next year?	貴方{あなた} は 来年 亜米利加{アメリカ} へ 行く 積もり{つもり} ですか
I worked as hard as possible.	私 は 出来る限り{できるかぎり} 熱心{熱心に} 働く{働いた}
That was the first time I had flown.	飛行機 に 乗る{乗った} の は 其れ{それ} が 初めて{始めて} です{でした}
The sun having set we stayed there for the night.	太陽 が 沈む{沈んで} 仕舞う{しまった} ので 私たち{私達} は 一晩 其処{そこ} に 滞在 為る{した}
Your idea is definitely worth thinking about.	君{君の} アイデア{アイディア} は 確かに 検討 為る{する} 価値 が 有る{ある}
"I'm not a child, but sometimes you talk to me as if I were a child."	私 は 子供 では無い{ではない} のに 貴方{あなた} ったら 時々{ときどき} 丸で{まるで} 私 が 子供 である か の 様{ような} 口の利き方{口のきき方} を 為る{する} の ね
He works at the welfare office.	彼 は 福祉事務所 で 働く{働いている}
"No, thank you. I'm so full."	否{いえ} 結構 もう 十分 です
He scraped mud from the door.	彼 は ドア の 泥 を 擦る{こすり} 落とす{落とした}
I owe it to my parents that I am so healthy.	私 が 健康{健康な} の は 両親 の お陰{おかげ} である
He saw no advantage in waiting any longer.	彼 は 此れ{これ} 以上 待つ{待って} も 何にも 成る{ならない} と 思う{思った}
"As great a scientist as he is, he lacks common sense."	彼 は 偉大{偉大な} 科学者 だ が 常識 が 無い{ない}
I'll tell you what.	まあ 聞く{聞き} なさい
He is careless about money.	彼 は 金銭 に 無頓着{むとんじゃく} である
Her mother made her a new dress.	彼女{彼女の} お母さん は 彼女 に 新しい 服 を 作る{作って} 上げる{あげました}
I do not mind what people say.	人 が 何 を 言う{言おう} と 気にしない
I would rather stay at home than go to the movies tonight.	今晩 は どちらかと言うと{どちらかというと} 映画 に 行く より 家 に 居る{い} たい
The popular singer committed suicide.	其の{その} 人気 歌手 は 自殺 為る{した}
You can read a lot more than you think you can.	自分 で 読む{読める} と 思う{思っている} よりも  実際 は ずっと 多く の 本 が 読む{読める} 物{もの} です
Four boys are making their way along the street.	人 の 少年 達{たち} が 道 を 歩く{歩いている}
"By the way, have you ever been to Hokkaido?"	所で{ところで} 貴方{あなた} は 北海道 に 行く{行った} 事がある{ことがあります} か
You should do your homework now.	今 宿題 を 遣る{やって} 仕舞う{しまい} なさい
The question is not so easy that anyone can answer it.	其の{その} 問題 は 誰でも 答える{答えられる} 程{ほど} 容易 では無い{ではない}
The government issued the following statement.	政府 は 次{次の} 様{ような} 声明 を 出す{出した}
If you mate a horse with an ass you will get a mule.	馬 と 驢馬{ロバ} を 交配 為せる{させる} と 騾馬{ラバ} が 生まれる
He is well spoken of by everybody.	彼 は 皆{みんな} に 褒める{ほめられる}
Betty challenged me to a game of tennis.	は 私 に テニス の 試合 を 挑む{挑んだ}
How long does it take to get to the stadium?	競技場 へ 行く のに 何れくらい{どれくらい} 時間がかかる{時間がかかります} か
Then it dawned on me that they were speaking Spanish.	彼ら が スペイン語 を 話す{話している} 事{こと} が 其の{その} 時 私 に 分かる{わかり} 始める{始めた}
Chris brought her a present and bravely gave it to her.	は プレゼント を 持ってくる{持ってきて} 勇気を出す{勇気を出して} 彼女 に 渡す{渡しました}
This magnificent cathedral dates back to the Middle Ages.	此の{この} 壮大{壮大な} 大聖堂 の 建立 は 中世 に 迄{まで} 遡る{さかのぼる}
The field is crying out for rain.	畑 は 今 雨 が 如何しても{どうしても} 必要 だ
She took back the coat she lent me.	彼女 は 私 に 貸す{貸した} コート を 取り返す{取り返した}
Ken met her on his way home.	は 家 に 帰る 途中 彼女 に 会う{会った}
He worked hard none the worse for the accident.	事故 に 会う{あった} のに 矢っ張り{やはり} 彼 は 一生懸命 働く{働いた}
"He went there, never to return."	彼 は 其処{そこ} に 行く{行った} 切り{きり} 二度と{２度と} 帰って来る{帰ってこなかった}
They won't come until tomorrow.	彼ら は 明日 迄{まで} 来る{来ない} だろう
I am quite pleased with you.	貴方{あなた} の 事{こと} が すっかり 気に入る{気に入りました}
"Hi, Bill. How are you?"	やあ 元気
Can I borrow your pen for a few minutes?	一寸{ちょっと} の 間 ペン を 貸す{貸して} 頂ける{いただけます} か
He is glad to hear the news.	彼 は 其の{その} 知らせ を 聞く{聞いて} 嬉しい{うれしがっている}
Did you mail the letter yesterday or today?	昨日 手紙を出す{手紙を出した} のだ{のです} か 其れ共{それとも} 今日 ですか
These teacups make a pair.	此れ等{これらの} ティーカップ は 対になる{対になっている}
"Listening to him, she got tired."	彼 の 話 を 聞く{聞いていて} 彼女 は 退屈 為る{した}
The shifting pattern of world trade is made clear in the following table.	世界 貿易 の 変動 パターン が 次{次の} 表 で 明らかにする{明らかにされている}
There is no telling what would happen if she doesn't show up.	若し{もし} 彼女 が 現れる{現れなかったら} 如何{どう} 成る{なる} か なんて 分かる{わからない}
It seems that he was very much amused by the story.	彼 は 其の{その} 話 が 余程{よほど} 面白い{面白かった} 様だ{ようだ}
We were eating lunch together.	私たち は 一緒に 昼食 を 摂る{とっていました}
"My teeth are too weak for apples, said the boy."	僕{僕の} 歯 は 迚も{とっても} 弱い{弱くって} 林檎{りんご} は 噛む{かめません} と 男の子  は 言う{言いました}
I sold the house to advantage.	私 は 家 を 有利{有利に} 売る{売った}
I can't tell you exactly how long it will take.	何れくらい{どれくらい} の 時間がかかる のか 正確{正確な} 所{ところ} は 申し上げる{申し上げ} 兼ねる{かねます}
I work every day save Sundays.	日曜日 以外 は 毎日 働く
The police still can't point out who committed the crime.	警察 は 未だ{いまだ} 犯人 を 特定 出来る{できない} で 居る{いる}
I sometimes play tennis with her.	私 は 時々 彼女 と テニス を 為る{する}
Let me have a cigarette.	煙草{タバコ} を 本 御{お} 呉れる{くれ}
He showed exceptional ability in mathematics.	彼 は 数学 に 優れる{優れた} 能力 を 示す{示した}
My water broke on the evening of the predicted birth date.	予定日 の 夕方 に 破水 為る{しました}
Choose one from among these products.	此れ等{これらの} 商品 の 中 から 一つ{１つ} 選ぶ{選び} なさい
I feel on top of the world.	最高 の 気分 だ
Why aren't women allowed to enjoy the same civil rights as men?	女性 は 何故{なぜ} 男性 と 同じ 市民権 を 享受 為る{する} 事{こと} が 許す{許されない} の か
I consulted with my father about the plan.	其の{その} 計画 に就いて{について} 父 に 相談 為る{した}
We use them often as parasols or umbrellas.	其れ{それ} を 日除け{日よけ} や 雨傘 の 代わり に 良く{よく} 使う{使います}
Their communication may be much more complex than we thought.	彼ら{彼らの} コミュニケーション は 我々 が 考える{考えて} 来る{きた} 物{もの} より 遥か{はるか} に 複雑 かも知れない{かもしれません}
There are very few passengers in the train.	其の{その} 列車 には 乗客 は 本の{ほんの} 僅か しか 居る{いなかった}
His object is to pass the test.	彼{彼の} 目的 は 其の{その} テスト に 合格 為る{する} 事{こと} です
It is getting warmer day by day.	日増しに 暑い{暑く} 成る{なる}
I can't agree with you on this matter.	私 は 此の{この} 事 で は 貴方{あなた} に 同意 出来る{できません}
The microphone is live.	マイク は 入る{入っている}
It is possible for us to do addition very quickly.	足し算 を 非常に 早く 為る{する} 事{こと} は 可能 だ
I got a new camera.	私 は 新しい カメラ を 手に入れる{手に入れた}
The way she spoke to us was suspicious.	彼女{彼女の} 私たち{私達} へ の 口の利き方{口のきき方} は 疑い深い{疑い深} 気{げ} だ{だった}
Is she all right?	あの人 は 変わる{変わり} は 無い{ない} ですか
He studied hard only to fail in the exam.	彼 は 一生懸命 勉強{勉強した} が 試験 に 落ちる{落ちた}
Don't draw a hasty conclusion from what you see now.	今 見る 事{こと} から 慌てる{あわてて} 断定 為る{して} は 行けない{いけない}
Is it always so crowded here?	何時も{いつも} こんなに 混雑 為る{している} のだ{のです} か
May I use the toilet?	トイレ を 拝借 出来る{できます} か
I will leave home when my mother comes back.	母 が 戻って来る{戻ってきたら} 私 は 出かける{でかけます}
Everyone should periodically receive a physical examination.	人 は 誰でも 定期的{定期的に} 健康診断 を 為る{して} 貰う{もらう} 可き{べき} だ
Winter comes earlier in North Europe.	北欧 で は 冬 の 訪れ が 早い
The letter was wrongly addressed.	其の{その} 手紙 は 宛名 が 間違う{間違っていた}
"In the ""Mafia"" tradition of organized crime, any member who discloses its operation is sure to be rubbed out."	組織犯罪 の 秘密結社 マフィア の 仕来たり{しきたり} で は 其の{その} 働き を 漏らす{洩らす} 物{もの} は 誰{だれ} でも 必ず{かならず} 消す{消される} ことになっている
He called a hotel for accommodations.	彼 は ホテル に 電話 で 宿泊 を 頼む{頼んだ}
It was Tom that broke the window yesterday.	昨日 窓 を 壊す{壊した} の は だ
May I use a pencil and some paper?	紙 と 鉛筆 を 借りる{借りて} も 良い{いい} ですか
"Women no longer are satisfied with their traditional role of housewife, and are seeking recognition of needs in the workplace."	女性 は 最早{もはや} 伝統的{伝統的な} 専業主婦 の 役割 に 満足 為る{せず} に 仕事場 で の 彼女 達{たち} の 必要性 を 認識 為る{して} 貰う{もらい} たい と 思う{思っている}
