We are given to regretting our past.	私たち は 過去 を 後悔 為る{し} 勝ち{がち} である
He is an able engineer.	彼 は 有能{有能な} 技師 です
I'm not responsible for what Tom did.	私 は が 為る{した} 事{こと} に対して 責任 は 無い{ない}
He answered that he could swim well.	彼 は 良く{よく} 泳ぐ{泳げる} と 答える{答えた}
I'm going to climb Mt. Kitadake.	に 登る 積もり{つもり} です
Glass breaks easily.	硝子{ガラス} は 壊れる{壊れ} 易い{やすい}
The noise kept me awake all night.	其の{その} 騒音 の 為に{ために} 私 は 一晩中 眠る{眠れなかった}
He was suspected of underground action.	彼 は 地下 活動 の 疑いをかけられる{疑いをかけられた}
I read it in today's edition.	今日 の 社説 で 其れ{それ} を 読む{読んだ}
	学校 の 制服 は 雪 の 為{chool was due to the snow.
I finished writing the letter by noon.	私 は 昼 迄{まで} に 手紙 を 書く{書き} 終える{終えた}
"Between ourselves, he is rather stupid."	ここだけの話 だ が 彼 は 可也{かなり} 愚か者 だ よ
No river in the world is longer than the Nile.	ナイル 川 より 長い 川 は 世界中 に 無い{ない}
This is too difficult for me.	此れ{これ} は 私 に取って{にとって} 難しい{難し} 過ぎる{すぎて} 分かる{分からない}
"Asked about her job, she said, ""My job is too complicated to sum up in a word."""	彼女 は 仕事 の 事{こと} を 尋ねる{尋ねられる} と 私{私の} 仕事 は 複雑 なので 一言 で は 要約 出来る{できません} と 言う{言った}
I got the engine going.	エンジン を 始動 為せる{させた}
"If you sum up feminist counselling in a few words, I suppose it would be counselling done from a woman's standpoint."	フェミニスト カウンセリング を 一言 で 説明 為る{する} なら 女性 の{の} 視点 に 立つ{たった} カウンセリング と 言う{いう} 事になる{ことになる} でしょうか
The event came about like this.	事件 は こんな風に{こんなふうに} 起きる{起きた}
Never did I tell her that I loved her.	私 は 決して 彼女 に 彼女 が 好き だ と は 言う{言っていない}
I don't know whether he'll join us or not.	彼 が 私たち に 加わる かどうか 私 は 知る{知らない}
Which way will you take?	何方{どちら} の 道 を 行く{行きます} か
We need to talk about how to do it.	其の{その} やり方 に就いて{について} 如何{どう} す可き{すべき} か を 話し合う 必要 が 有る{ある}
"I would appreciate it if you could find time to see Mr Fukuoka, or to introduce him to one of your associates."	氏 に 御{お} 会う{会い} 頂ける{いただける} か 或は{あるいは} 貴社 の 方 を どなたか 御{ご} 紹介 頂く{いただけます} 様{よう} お願いいたします
We experience and understand the world through signals that are received by the senses and interpreted by the brain - and both stages are subject to distortion.	私たち が 此の{この} 世界 を 経験 為る{し} 理解 為る{する} の は 五感 を 通じて 受け入れる{受け入れられ} 脳 に因って{によって} 解釈 為れる{される} 信号 を 通じる{通じて} なのである 而して{そして} 此の{この} 両方 の プロセス 共{とも} 歪める{ゆがめられ} 易い{やすい}
I argued her out of going skiing.	私 は 彼女 に スキー を 思いとどまる{思いとどまらせた}
I'll buy a through ticket to Hakata.	迄{まで} の 通し切符 を 買う{買いましょう}
She flared up at the sight of her husband walking with another woman.	夫 が 別{別の} 女 と 歩く{歩いている} の を 見る{みて} 彼女 は カッとなる{かっとなった}
What kind of part-time job do you have?	何か アルバイト は 為る{しています} か
It is difficult to shoot a bird flying in the air.	空を飛ぶ{空を飛んでいる} 鳥 を 撃つ 事 は 難しい
I saw a flock of sheep.	私 は 羊 の 群 を 見る{見た}
He is a doctor by profession.	彼 の 職業 は 医師 だ
"To do him justice, he is an able man."	公平{公平に} 言う と 彼 は 有能{有能な} 男 だ
It is ten years since I left college.	私 が 大学を出る{大学を出て} から 年 になる{になります}
She likes traveling best of all.	彼女 は 旅行 が 取り分け{とりわけ} 好き である
I just dropped in.	一寸{ちょっと} 立ち寄る{立ち寄って} 見る{みた} のだ{んだ}
This watch is as expensive a gift as that bracelet.	此の{この} 時計 は 彼の{あの} ブレスレット と 同じくらい 高価{高価な} 贈り物 です
She left home after three days.	彼女 は 三日 後 に 家 を 離れる{離れた}
Forever and always? asked the little black rabbit.	何時も{いつも} 而して{そして} 何時までも{いつまでも} と 小さい 黒い 兎{ウサギ} は 聞く{ききました}
She returned the book to the library.	彼女 は 図書館 に 本 を 返す{返した}
He found difficulty in making ends meet on his small salary.	少し の 給料 を やり繰り{やりくり} 為る{して} 暮らす{暮らして} 行く{いく} の は 難しい と 彼 は 思う{思った}
There are many ships in the harbor.	港 には 沢山{たくさん} の 船{舟} が 居る{いる}
Imagine that you have a time machine.	タイムマシーン を 持つ{持っている} と 想像 為る{して} 見る{見て} 下さい{ください}
She waited on her husband all day long.	彼女 は 一日中{１日中} 夫 の 世話をする{世話をした}
I will go to Sydney on business next month.	私 は 来月 仕事 で シドニー に 行く でしょう
I am not keen on this kind of music.	私 は こういった 音楽 は 余り{あまり} 好き では無い{ではない}
My fellow Americans: ask not what your country can do for you; ask what you can do for your country.	アメリカ合衆国 の 同胞 諸君 国家 が 諸君 の 為に{ために} 何 を 為る{して} 呉れる{くれる} か を 求める{求めず} 諸君 が 国家 の 為に{ために} 何 を 出来る{できる} か を 求める{求めよう}
She could not bear the sight of the mean man.	彼女 は 其の{その} 卑劣{卑劣な} 男 を 見る の が 嫌 だ{だった}
I'm taking off now.	そろそろ 行く わね
Ask your dad to help you.	お父さん に 手伝う{手伝って} 貰う{もらい} なさい
He left without so much as saying good-by to me.	彼 は 私 に 左様なら{さよなら} さえ 言う{言わないで} 出て行く{出ていった}
He intended to have visited the temple last week.	彼 は 先週 其の{その} 御{お} 寺 を 訪ねる{たずねる} 積もり{つもり} だ{だった}
You should think before you begin to speak.	きちんと 考える{考えて} から 話す{話し} 始める{始め} 無きゃいけない{なくてはいけません}
Japan imports oranges from California.	日本 は カリフォルニア から オレンジ を 輸入 為る{している}
My first son was named after my uncle.	長男 の 名前 は 伯父さん{おじさん} の 名前 から 取る{取りました}
"The man began to take off his hat, glasses and mask."	男 は 帽子 眼鏡 仮面 を 脱ぐ{脱ぎ} 始める{始めた}
Look at that picture on the desk.	机 の 上 に 有る{ある} 其の{その} 写真 を 見る{見} なさい
The storm prevented our plane from taking off.	暴風 の 為{ため} 私たち の 飛行機 は 離陸 出来る{できなかった}
A lot of trees were cut down.	沢山{たくさん} の 木 が 切り倒す{切り倒された}
Are you happy?	君 は 幸せ ですか
He earns his living by playing the piano.	彼 は ピアノ の 演奏 で 生計を立てる{生計を立てている}
He was relieved of his heavy responsibility.	彼 は 重責 を 解く{解かれた}
"We were running out of gas, and what was worse, it began to snow heavily."	段々{だんだん} ガソリン が 無くなる{なくなって} 来る{きた} その上 さらに悪いことに は 雪 が 激しい{激しく} 降り始める{降り始めた}
He has ants in his pants.	彼 は そわそわ 為る{している}
I think it dangerous walking alone at night.	夜道 を 一人{１人} で 歩く の は 危険 だ と 思う{思います}
We must take his youth into account.	私たち は 彼{彼の} 若い{若} さ を 考慮に入れる{考慮に入れ} ねばならない{なければならない}
See you next week!	又{また} 来週
The Prime Minister was obliged to resign from the Cabinet.	首相 は 内閣 から の 辞職 を 余儀なくされる{余儀なくされた}
The party lasted more than three hours.	パーティー は 時間 以上 も 続く{続いた}
He had a firm belief in his God.	彼 は 自分 の 神 を 硬い{堅く} 信じる{信じていた}
She doesn't always take a trip to France in summer.	彼女 は 夏 になると 何時も{いつも} 仏蘭西{フランス} へ 旅行 為る{する} 訳ではない{わけではない}
They held a protest march for freedom.	彼ら は 自由 を 求める{求めて} 抗議 デモ を 行く{行った}
I want to come to terms with him.	彼 と 仲直り したい
I was surprised because he lifted me up with ease.	彼 が 私 を 簡単{簡単に} 抱き上げる{抱き上げた} ので 私 は 驚く{驚いた}
He had grown senile recently.	彼 は 此の頃{このごろ} 頭 が 呆ける{ぼけて} 来る{きた}
She's a very earnest person.	彼女 は 迚も{とても} 真面目{まじめな} 人 だ
What did you come here for?	如何して{どうして} 此処{ここ} へ 来る{来た} のだ{のです} か
His ideas carry a lot of weight.	彼{彼の} 意見 に 発揚 影響力 が 有る{ある}
You've given me good advice.	君 は 良い{いい} 助言 を 為る{して} 呉れる{くれた}
He speaks as if he had studied abroad.	彼 は 如何にも{いかにも} 留学 為る{した} 様{ような} 事 を 言う
I have been writing letters all day long.	私 は 一日中{１日中} 手紙 を 書く{書いていた}
I am quite clear that it is a fact.	其れ{それ} が 事実 だ と 言う{いう} 事{こと} は 僕{ぼく} には はっきり 分かる{わかっている}
Please help me fill out this form.	此の{この} 紙  に 記入 為る{する} の を 手伝う{手伝って} 下さい{ください}
Can you spare a minute? I'd like to discuss something of importance to both of us.	一寸{ちょっと} 時間を割く{時間を割いて} 呉れる{くれません} か 二人{ふたり} に取って{にとって} 大事{大事な} 事 を 話し合う{話し合い} たい のだ{のです}
"I got cold, so I turned on the heater."	寒い{寒く} 成る{なった} ので ヒーター を 付ける{つけた}
Father made a long tear in his sleeve.	父 は 袖 に 長い 裂け目 を 作る{作った}
They laughed over their silly misunderstanding.	彼ら は 笑う{笑い} 乍ら{ながら} お互いに 詰らない{つまらぬ} 誤解 を 為る{していた} 物{もの} だ と 語り合う{語り合った}
Do you mind if I call on you tomorrow?	明日 伺う{お伺い} 為る{して} も 宜しい{よろしい} ですか
I will side with you just this once.	今回 丈{だけ} は 君{君の} 味方 を 為る{しよう}
Our school beat Keio at baseball.	僕たち の 学校 は 野球 で を 負かす{負かした}
You'll regret that!	今{いま} に 後悔 為る{する} ぞ
He revived the child with artificial respiration.	彼 は 人工呼吸 で 子供 を 生き返る{生き返らせた}
"There being no vacant seat in the bus, I kept on standing."	バス には 空席 が 無い{なかった} ので 私 は ずっと 立ち続け だ{だった}
We have French in third period.	時間 目 には フランス語 が 有る{あります}
Meg is curious to know everything about Japan.	は 日本 に就いて{について} 何でも 知る{知り} たがる
I'll be your first patient.	私 は 貴方{あなた} の 第一 号 の 患者 になる わ
The man was held in police custody.	其の{その} 男 は 拘留 為れる{された}
She gave me plenty to eat.	彼女 は 私 に 沢山{たくさん} 食べ物 を 呉れる{くれた}
"If you have a cold, lack of sleep is very bad for you."	風邪をひく{かぜをひいている} 時{とき} は 睡眠不足 は 良い{良くありません}
Choose a present carefully.	贈り物 は 慎重{慎重に} 選ぶ{選び} なさい
He liked history among others.	彼 は 中でも 歴史 が 好き だ{だった}
I told them again to turn down the radio.	彼ら に ラジオ の 音 を 小さい{小さく} 為る{する} 様に{ように} 何度 も 言う{言った}
They complained about their low wages.	彼ら は 低賃金 に 不満 を 言う{言った}
I lost my travelers checks.	トラベラーズチェック を 無くす{なくして} 仕舞う{しまいました}
I read fifty pages further.	私 は 更に 頁{ページ} 読む{読んだ}
The climate of Tokyo is different from that of London.	東京 の 気候 は 倫敦{ロンドン} とは 異なる{異なっている}
Then who are you? Are you Elijah?	では 一体{いったい} 誰 ですか 貴方{あなた} は ですか
I tried writing a novel.	私 は 試し{ためし} に 小説 を 書く{書いて} 見る{みた}
Blue Sky Sport is closed every Thursday.	店 は 毎週 木曜日 が 御{お} 休み です
There is no other country in the world where earthquakes are as frequent as in Japan.	日本 程{ほど} 地震 の 多い 国 は 無い{ない}
I think she's over 40 years old.	彼女 は 少なくとも 才 は 越える{越えている} と 思う
"As a child, Bob lived in Boston."	子供 の 時{とき} は ボストン に 住む{住んでいた}
He regretted having quit his job.	彼 は 仕事 を 辞める{やめた} 事{こと} を 後悔 為る{した}
Nobody speaks well of that politician.	誰も 彼の{あの} 政治家 を 褒める{ほめない}
He will cope well with difficulties.	彼 は 困難 を 上手い{うまく} 切り抜ける{切り抜けて} 行く{いく} だろう
We are giving Tom a birthday party.	の 誕生パーティー を 開く 予定 だ
It cost me ten thousand yen to have my television set repaired.	テレビ を 修繕 為せる{させたら} 円 取る{とられた}
The practice still prevails locally in parts of Japan.	其の{その} 習慣 は 今 尚{なお} 日本 の 所々 で 行われる{行われている}
Anyway what are you on about? Going around sleeveless in this cold.	大体{だいたい} 貴方{あんた} 此の{この} 寒い のに ノースリーブ で 何 言う{いってん} の よ
I hope the economy picks up soon.	景気 が 直ぐに{すぐに} 回復 為る{する} と 良い{いい} のだ{のです} が
He used the dictionary.	彼 は 其の{その} 辞書 を 使う{使った}
The doctor advised me to take up some sport to stay in shape.	医者 は 私 に 健康 の 為に{ために} 何か 運動 を した方がいい{したほうがいい} です よ と 言う{言いました}
"I lost my watch, so I have to buy one."	私 は 時計 を 無くす{なくした} ので 時計 を 買う{買わ} ねばならない{なければいけない}
Depending on the results both companies may be put under administrative guidance from February.	結果 次第 で は 両社 に対して 二月{2月} 以来 の 行政指導 が 行う{行われる}
I was in trouble with the police last night.	私 は 昨晩 警察 と いざこざ を 起こす{起こした}
None of the programs look interesting to me.	番組 の 何れも{どれも} 私 には 面白い{面白} そう に 見える{見えない}
"If it is interesting, any book will do."	面白い{おもしろければ} どんな 本 でも 良い{いい} です よ
You must take care of yourself.	貴方{あなた} は 体 を 大事 に 為る{し} ねばならない{なければいけません}
He led a life of luxury.	彼 は 贅沢{贅沢な} 生活 を 送る{送った}
I think I must be leaving since it is getting late.	遅い{遅く} 成る{なって} 来る{きた} ので もう 帰る{帰ります}
He turned a deaf ear to my advice.	彼 は 我々 の 忠告 に 耳を貸す{耳を貸さなかった}
"When we reached the summit, we all yelled out into the void."	頂上 に 着く と 皆 で と 叫ぶ{叫んだ}
It is six years since I started to study English.	私 は 英語 を 始める{始めて} から もう 年 になる
I am seldom at leisure.	私 は 滅多に{めったに} 暇{暇な} 時{とき} が 無い{ない}
You are acting beyond your position.	其れ{それ} は 越権行為 だ
I lost my shirt on the stock market.	株 で すってんてん になる{になっ} ちまう{ちまった}
He jumped across the puddle.	彼 は 水溜まり{水たまり} を 飛び越す{飛び越した}
He is of royal blood.	彼 は 王 の 血 を 引く{引いている}
They are boring a hole.	彼ら は 穴 を 掘る{掘っている}
I'll be late for school!	学校 に 遅刻 為る{し} そう
I have a lot of work to get through today.	今日 は 沢山{たくさん} の 仕事 を 終える{終え} ねばならない{なければならない}
He yielded to temptation and took drugs.	彼 は 誘惑 に 屈する{屈し} 麻薬 に 手を出す{手を出して} 仕舞う{しまいました}
Mayuko appears wise.	は 賢い{賢} そう だ
Please send the merchandise by return.	折り返し 商品 を 郵送 為る{する} 可し{べし}
It is beginning to tell on him.	其れ{それ} は 彼 の 身 に 応える{応え} 出す{だした}
I don't feel inclined to play baseball today.	今日 は 野球 を 遣る気{やる気} が 為る{しない}
The offer is worthy of being considered.	其の{その} 申し出 は 考慮 に 値する
We were arguing on different planes to the last.	最後まで 議論 の 歯車 が 噛み合う{噛み合わなかった}
My mother had cooked supper when I got home.	私 が 帰る{帰った} 時{とき} 母 は 夕食 の 料理 を 終える{終えていた}
Tastes differ.	人 の 好み{このみ} は 異なる
The president laughed in spite of himself.	大統領 は 思わず 笑う{笑って} 仕舞う{しまった}
I've never been to Paris.	未だ{まだ} 巴里{パリ} に 行く{行った} 事が無い{ことがない}
I am sure of success.	私 には 成算 が 有る{ある}
Did he go there?	彼 は 其処{そこ} へ 行く{行きました} か
Jack explained to me how to change the wheel of the car.	は 僕 に 車 の タイヤ 交換 の 仕方 を 説明 為る{して} 呉れる{くれた}
He is the picture of his father.	彼 は 父 そっくり だ
We are longing for world peace.	我々 は 世界平和 を 望む{望んでいる}
"I want to buy this book not because it is cheap, but because it is useful."	安い から で は 無い{なく} 役に立つ から 私 は 此の{この} 本 を 買う{買い} たい
I need some butter. Do you have any?	バター が 要る の{ん} だ けど 幾らか{いくらか} 有る{あります} か
It's too late to turn back now.	今 引き返す には 遅い{遅} 過ぎる{すぎる}
The digression is escalating more and more.	脱線 が どんどん エスカレート 為る{して} 行く{いく}
Don't kill the goose that lays the golden eggs.	金 の 卵 を 生む 鵞鳥{ガチョウ} を 殺す な
Raise your hand to the sky.	其の{その} 手 を 空 へ 突き 上げる{上げろ}
The iron broke down due to over-heating.	其の{その} アイロン は 過熱 の 為に{ために} 故障 為る{した}
It's not wise of you to turn down his offer.	彼{彼の} 申し出 を 断る とは 君 も 賢明 では無い{ではない}
He is always complaining about the way I do things.	彼 は 何時も{いつも} 私{私の} やり方 に 文句 を 言う{言っている}
You must carry the task through to the end.	最後まで 其の{その} 仕事 を やり遂げる{やり遂げ} ねばならない{なければならない}
She is inferior to him in math.	彼女 は 彼 より 数学 に於いて{において} 劣る{劣っている}
Overseas service here.	此方{こちら} 国際電話 の 係{係り} です
I burned my hand with an iron.	アイロン で 手 を 火傷{やけど} 為る{しました}
Jane was waiting with her back against the tree.	は 背 を 木 に 凭れる{もたれ} 架ける{かけて} 待つ{待っていた}
I had no idea it would put you to so much trouble.	こんなに 御{ご} 迷惑をかける と は 思う{思って} 居る{おりませんでした}
How long do I have to wait for the next bus?	次{次の} バス 迄{まで} には どの位{どのくらい} 待つ{待ちます} か
"Should he call me in my absence, please tell him that I will call him back."	万一 私{私の} 留守中 に 彼 が 電話をかける{電話をかけて} 来る{きたら} 折り返し 私{私の} 方 から 電話をかける
My sister-in-law had four children in five years.	義理の姉 は 五 年間 で 四人 の 子供 を 生む{生んだ}
Your idea is definitely worth thinking about.	君{君の} アイデア{アイディア} は 確かに 検討 為る{する} 価値 が 有る{ある}
"If you do your best, no one will blame you."	最善を尽くす{最善をつくせば} 誰も 君 を 咎める{とがめない} でしょう
"She is a lady, and ought to be treated as such."	彼女 は 女 である{であり} そのよう{そのように} 待遇 為れる{される} 可き{べき} である
"Sorry to be so direct, but how much did you pay for this?"	ぶっちゃける{ぶっちゃけた} 話 此れ{これ} って 幾ら{いくら} 位{ぐらい} 為る{した} の
The boy sat among the girls.	其の{その} 少年 は 少女 達{たち} の 間 に 座る{座った}
You should have helped him with his work.	君 は 彼 の 仕事 を 手伝う 可き{べき} だ{だった}
"When meeting a person for the first time, be sure to pay attention to the distance placed between yourself and your partner."	人 に 初めて 会う 時{とき} には 必ず 自分 と 相手 と の 距離 に 注意 を 払う{払い} なさい
Wondering if my daughter had arrived safely I tried to call her but couldn't get through.	娘 が 無事 に 着く{着いた} かどうか と 思う{思って} 電話をかける{電話をかけよう} とする{とした} が 通じる{通じなかった}
He came down in the world.	彼 は 落ちぶれる{落ちぶれた}
You will have to go to England next year.	貴方{あなた} は 来年 は 英吉利{イギリス} へ 行く{行か} ねばならない{なければならない} でしょう
Try out my reins and my heart.	私{私の} 心 と 思い と を 練る{練り} 清める{清めて} 下さい{ください}
He has a large store of food.	彼 は 食料 の 蓄え は 十分{十分に} 有る{ある}
They moved ahead slowly.	彼ら は ゆっくり 前進 為る{した}
I want this letter registered.	此の{この} 手紙 を 書類 に 為る{して} 貰う{もらい} たい
"If UFOs were to attack the earth, what would become of us?"	仮に ＵＦＯ が 地球 を 攻撃 為る{して} 来る{来たら} 我々 は 如何{どう} 成る{なる} だろう
Don't be scared of making mistakes.	失敗 を 怖がる 事{こと} は 有る{ありません}
He fell captive to her charms.	彼 は 彼女{彼女の} 魅力 の 虜{とりこ} になる{になった}
You should know better.	君 は もっと 分別 を 持つ{もち} なさい
Those are not your chairs.	其れ等{それら} は 君たち の 椅子 です{ではありません}
They blamed the failure on George.	彼ら は 失敗 為る{した} の を の 所為にする{せいにした}
She is a high-liver.	彼女 は 高望み 為る{する} タイプ です
I can't walk any farther.	もう 此れ{これ} 以上 歩く{歩けない}
Persons under age are prohibited from smoking.	未成年者 は 喫煙 を 禁じる{禁じられている}
The population of Tokyo is about five times as large as that of our city.	東京 の 人口 は 我々 の 市 の 人口 の 約 倍 である
I'll expect you next week.	来週 待つ{おまち} 為る{して} 居る{おります}
Don't be deceived by appearances.	外見 に 騙す{だまされる} な
We celebrated the New Year with a party.	私たち{私達} は パーティー を 為る{して} 新年 を 祝う{祝った}
What marvelous weather.	何て 素晴らしい{すばらしい} 天気 だろう
The secret seems to have leaked out.	秘密 が 漏れる{漏れた} らしい
When can I see you?	何時{いつ} お目に掛かる{お目にかかれます} か
Recent overseas transfers show that productivity improvements in Japanese manufacturing industry have almost reached their limit.	最近{最近の} 海外 移転 の 動き を 見る{見て} も 分かる{わかる} 様{ように} 製造業 の 生産性 改善 も 限界 に 近い 所{ところ} 迄{まで} 進む{進んでいる}
Game birds abound in the area.	其の{その} 地区 猟鳥 が 多い
I do not want him to be careless.	私 は 彼 に 不注意 である{であって} 貰う{もらい} たい{たくありません}
Justice and kindness are virtues.	正義 と 親切 は 美徳 である
The Internet is very useful for knowing the circumstances of each part of the world.	インターネット は 世界 各地 の 状況 を 知る のに 迚も{とても} 役に立つ{役に立ちます}
We furnished the refugees with blankets.	我々 は 避難民 に 毛布 を 与える{与えた}
