Will the work be finished by tomorrow?	其の{その} 仕事 は 明日 迄{まで} に 完成 為る{する} だろうか
A person named Itoh wants to meet you.	さん と言う{という} 方 が 会う{お会い} したい そうだ{そうです}
Both of my parents love each other.	私{私の} 両親 は お互いに 愛し合う{愛し合っている}
He is afraid his wife is not very domestic.	彼 は 妻 は 余り{あまり} 家事 を 好き では無い{ではない} と 思う{おもっている}
The judgement went against the government.	判決 は 政府 に 不利 だ{だった}
I bought a woolen sweater.	私 は ウール の セーター を 買う{買った}
This is for you.	此れ{これ} を 貴方{あなた} に 差し上げる{差し上げます}
Traffic accidents are likely to occur on rainy days.	交通事故 は 雨 の 日 に 起こる{起こり} 易い{やすい}
He turned up an hour later.	彼 は 一時間 遅れる{遅れて} 現れる{現れた}
He reared three children by himself.	彼 は 自分 一人で 三人 の 子供 を 育てる{育てた}
Land made him a rich man.	土地 で 彼 は 成金{成り金} になる{になった}
They are moving from the peaceful hills and the countryside to the busy world of streets and crowds.	平和{平和な} 丘 や 田園 地帯 から 通り が 有る{あり} 群衆 が 居る{いる} 忙しい 世界 へ と 移動 為る{する} の である
The fort was attacked by surprise.	砦 は 不意{不意に} 攻撃 為れる{された}
"All right, do it your own way, but don't blame me if you fail."	分かる{わかった} 君{君の} 好きなように 為る{しろ} でも 失敗 為る{した} 時{とき} 私 を 悪い{悪く} 言う な よ
Where is the money exchange counter?	両替所 は 何処{どこ} ですか
I'll teach you how to drive a car.	君 に 自動車 の 運転 法 を 教える{教えて} 上げる{あげよう}
Will you have another cup of tea?	もう 一杯 お茶 御{お} 如何{いかが} ですか
He dominates his family and makes all the decisions.	彼 は 其の{その} 家 を 支配 為る{し} 全て{すべての} 決断 を 為る{する}
"If he had carried the map with him, he wouldn't have got lost."	若しも{もしも} 地図 を 持つ{持っていた} なら{ならば} 彼 は 道に迷う{道に迷わなかっ} たろう に
I will stay here for a short period.	少し の 間 此処{ここ} に 滞在 為る{します}
I was relieved to know that the operation was a success.	私 は 手術 が 成功 為る{した} と 知る{知って} 安心 為る{しました}
Women usually live longer than men.	女性 は 一般に 男性 より 長生き 為る{する}
We kept on working for hours without eating anything.	我々 は 何も 食べる{食べず} に 何時間 も 働く{働き} 続ける{続けた}
I used to go skiing in winter.	私 は 良く{よく} 冬 に スキー に 出かける{出かけた} 物{もの} だ{だった}
He was covered with sweat.	彼 は 汗 びっしょり だ{だった}
Her hair is long and beautiful.	彼女{彼女の} 髪の毛 は 長い{長くて} 美しい
Salt helps to preserve food from decay.	塩 は 食べ物 を 腐る{腐らせず} 長持ち 為せる{させる} のに 役立つ
Bill is my junior by two years.	は 私 より 二つ{２つ} 年下 だ
Please clean the dirty floor.	汚れる{汚れた} 床 を 奇麗{きれい} に 為る{して} 下さい
His English leaves nothing to be desired.	彼{彼の} 英語 は 申し分 が 無い{ない}
Please write this down.	此れ{これ} を 書き留める{書き留めて} 下さい
The tower fell into ruin.	其の{その} 塔 は 崩壊 為る{した}
The newspaper called for the government to stop inflation.	其の{その} 新聞 は 政府 に インフレ を 止める 様に{ように} 求める{求めた}
It's ten minutes' walk to the station.	駅 迄{まで} 歩く{歩いて} 分 です
Give me a reason for doing such a thing.	そんな 事{こと} を 為る{する} 訳{わけ} を 教える{教えて} 呉れる{くれ}
I'll be reading a book.	私 は 本 を 読む{読んでいる} でしょう
I bought it.	私 は 其れ{それ} を 買う{買った}
Who will look after the baby?	誰 が 其の{その} 赤ちゃん の 世話をする{世話をします} か
He would not listen to my advice.	彼 は 私{私の} 忠告 を 聞き入れる{聞き入れよう} とする{としなかった}
She couldn't stand the heat in the train.	彼女 は 列車 の 中 の 熱い{あつ} さ に 我慢 出来る{できなかった}
He behaves as if he were somebody.	彼 は 自分 が 凄い{すごい} 人 でもある か の様に{のように} 振る舞う
"Made in Italy, these jeans were very expensive."	伊太利{イタリー} 製 なので 此の{この} ジーンズ は 迚も{とても} 値段 が 高い{高かった}
Sit down and rest for a while.	座る{座って} 暫く{しばらく} 休む{休み} なさい
He came back about nine last night.	彼 は 昨夜 時 頃{ごろ} 戻って来る{戻ってきた}
He's a quick walker.	彼 は 歩く の が 早い{速い}
He gave me what little money he had.	彼 は 持つ{持っている} 無けなし{無け無しの} お金 を 私 に 呉れる{くれた}
It was next to impossible to get a trained pilot.	訓練 為れる{された} パイロット を 手に入れる の は 不可能{不可能に} 近い{近かった}
The price of rice rose by more than three percent.	米 の 価格 が パーセント 以上 上がる{あがった}
His wife had him wrapped around her little finger.	彼 は 夫人 の 意{い} の 儘{まま} だ{だった}
Women didn't care for him.	彼 は 女 に 好く{好かれなかった}
"Not being well, she stayed home."	気分が悪い ので 家 に 居る{いた}
It is beneath him to say such a thing.	そんな 事{こと} を 言う とは 彼 らしい{らしく} も 無い{ない}
He can both speak and write Russian.	彼 は ロシア語 が 話す{話せる} し 書く 事が出来る{ことができる}
The song descended from a legend.	其の{その} 歌 は 伝説 に 由来 為る{する} 物 だ{だった}
We may miss the next bus but at any rate we'll be there before midnight.	次{次の} バス には 遅れる だろう が 兎に角{とにかく} 真夜中 前 には 着く よ
I'm going to Europe by way of Anchorage next week.	私 は 来週 アンカレッジ 経由 で 欧羅巴{ヨーロッパ} へ 行く 積もり{つもり} です
I found Kate more active than her brother.	が お兄さん より 活発 である 事{こと} が 分かる{わかった}
Where can I obtain a map of Europe?	何処{どこ} へ 行く{行けば} 欧羅巴{ヨーロッパ} の 地図 が 手に入る{手に入ります} か
It's getting dark. You'd better go home.	暗い{暗く} 成る{なって} 来る{きました} 帰る{帰った} 方がいい です よ
Would you like to dance?	踊る{踊って} 貰う{もらえます} か
We walked as far as the park.	我々 は 公園 迄{まで} 歩く{歩いた}
The marvel is that he succeeded in the adventure.	彼 が 其の{その} 冒険 に 成功 為る{した} と は 驚くべき 事{こと} だ
Window or aisle?	窓側 か 通路側 何方{どちら} に 為さる{なさいます} か
He teaches mathematics as well as English.	彼 は 英語 と 同様 数学 も 教える{教えます}
"Besides attending the funeral, she needs to make all the arrangements."	彼女 は 葬儀 に 参加 為る{する} だけでなく 全て{すべての} 段取り を 付ける{つけ} 無くてはならない{なくてはならない}
I'll leave when she comes back.	彼女 が 戻って来る{戻ってきたら} 出発{出発します}
I saw a boy swimming across the river.	男の子  が 泳ぐ{泳いで} 川 を 渡る{渡っている} の が 見える{見えました}
I can't stand humidity.	私 は 湿気 が 我慢 出来る{できない}
Give a dog a bad name and hang him.	一度 悪名 を 取る{取ったら} 最後 だ
He is man of moderate views.	彼 は 中庸 を 心得る{心得た} 人物{じんぶつ} である
Which period of history are you studying?	貴方{あなた} は 歴史 の 何の{どの} 時代 を 研究 為る{しています} か
I met my classmate.	私 は 級友 に 会う{会った}
He may well get angry with her.	彼 が 彼女 に 腹を立てる の も 尤も{もっとも} だ
Would you like to go have a drink?	何処か{どこか} へ 飲む{飲み} に 行く{行き} ましょうか
Do you mind if I turn down the TV?	テレビ の 音声 を 低い{低く} 為る{して} も 良い{いい}
I am really in the dark on this case.	此の{この} 件 に関して は 全く{まったく} 知る{知らない}
She is not eligible for marriage.	彼女 は 結婚{結婚の} 資格 は 無い{ない}
He writes an English letter.	彼 は 英語 の 手紙 を 書く{書きます}
You could tell by the ear-to-ear grin that came to his face that he really had something to smile about.	喜色満面 の 笑み を 浮かべる{浮かべている} けど 彼 余程{よっぽど} 嬉しい 事がある{ことがあった} の{ん} だろう な
"In the absence of definite evidence, he was acquitted."	証拠 不十分 で 彼 は 無罪 となる{となった}
This is not to say that Mr. Tanaka did it all on his own.	何も{なにも} さん の 力 が オンリー だ と言うのは{というのは} 無い{ない}
She was a genius in mathematics.	彼女 は 数学 の 天才 だ{だった}
